{
  "$schema": "https://json-schema.org/draft/2020-12/schema",
  "title": "Money graph engine result v1",
  "type": "object",
  "required": ["schema_version", "engine_version", "nodes", "top_nodes", "meta"],
  "properties": {
    "schema_version": {"const": "1.0"},
    "engine_version": {"type": "string"},
    "engine": {"type": "string", "description": "Legacy Python identification alias; added in engine 1.1.0"},
    "nodes": {"type": "array", "items": {"$ref": "#/$defs/node"}},
    "top_nodes": {"type": "array", "maxItems": 20, "items": {"$ref": "#/$defs/top_node"}},
    "meta": {"type": "object"}
  },
  "$defs": {
    "gid": {"type": "string", "pattern": "^(0|[1-9][0-9]*|-[1-9][0-9]*)$"},
    "score": {"type": "number", "minimum": 0, "maximum": 1},
    "explanation": {"type": "string", "minLength": 1, "maxLength": 200},
    "role": {"enum": ["consolidator", "transit", "distributor", "terminal", "coordinator", "peripheral"]},
    "node": {
      "type": "object",
      "required": ["gid", "cluster_id", "role", "role_score", "priority_score", "evidence", "why", "features", "role_candidates", "priority_breakdown", "warnings"],
      "properties": {
        "gid": {"$ref": "#/$defs/gid"},
        "cluster_id": {"type": "integer", "minimum": 0},
        "role": {"$ref": "#/$defs/role"},
        "role_score": {"$ref": "#/$defs/score"},
        "priority_score": {"$ref": "#/$defs/score"},
        "evidence": {"$ref": "#/$defs/explanation"},
        "why": {"$ref": "#/$defs/explanation"},
        "features": {"type": "object"},
        "role_candidates": {"type": "array", "minItems": 1, "items": {
          "type": "object", "required": ["role", "score"],
          "properties": {"role": {"$ref": "#/$defs/role"}, "score": {"$ref": "#/$defs/score"}}
        }},
        "priority_breakdown": {"type": "object"},
        "warnings": {"type": "array", "items": {"type": "string"}}
      }
    },
    "top_node": {
      "type": "object",
      "required": ["rank", "gid", "role", "priority_score", "why"],
      "properties": {
        "rank": {"type": "integer", "minimum": 1},
        "gid": {"$ref": "#/$defs/gid"},
        "role": {"$ref": "#/$defs/role"},
        "priority_score": {"$ref": "#/$defs/score"},
        "why": {"$ref": "#/$defs/explanation"}
      }
    }
  }
}
