{
  "engine": "money-graph-cpp/1.2.0",
  "engine_version": "1.2.0",
  "meta": {
    "config": {
      "boundary_role_multiplier": 0.8,
      "consolidator_min_in_percentile": 0.5,
      "consolidator_min_senders": 3,
      "coordinator_min_external_clusters": 2,
      "coordinator_min_receivers": 2,
      "coordinator_min_seeds": 3,
      "coordinator_min_senders": 2,
      "coordinator_min_volume_percentile": 0.75,
      "distributor_min_out_percentile": 0.5,
      "distributor_min_receivers": 5,
      "max_depth": 4,
      "priority_cluster_saturation": 3,
      "priority_seed_saturation": 5,
      "priority_weights": {
        "counterparties": 0.2,
        "external_clusters": 0.15,
        "seed_reach": 0.35,
        "volume": 0.3
      },
      "seed_role_multiplier": 0.85,
      "transit_ratio_max": 1.2,
      "transit_ratio_min": 0.8
    },
    "edge_count": 4,
    "limitations": [
      "Directed reachability is not proof of provenance or time-ordered money flow",
      "Only intrabank transfers >=5000 KZT in the observed month are available",
      "No full account balances; depth boundary and seed inflows are incomplete",
      "Clusters and rule thresholds are hypotheses, not labels of criminal organizations"
    ],
    "node_count": 6,
    "priority_semantics": "Review priority, not probability of wrongdoing",
    "role_counts": {
      "consolidator": 1,
      "peripheral": 5
    },
    "role_score_semantics": "Heuristic rule strength, not calibrated probability",
    "seed_count": 3
  },
  "nodes": [
    {
      "cluster_id": 0,
      "evidence": "Недостаточно признаков роли: отправителей 0, получателей 1, достижим из 0 seed. Seed: входящие неполны.",
      "features": {
        "boundary_node": false,
        "counterparty_count": 1,
        "counterparty_percentile": 0.8,
        "cross_cluster_edges": 1,
        "direct_seed_senders": 0,
        "external_cluster_count": 1,
        "in_percentile": 0.0,
        "min_seed_hops": null,
        "nonself_in_deg": 0,
        "nonself_out_deg": 1,
        "observed_in_kzt": 0.0,
        "observed_out_kzt": 10000.0,
        "observed_pass_through": null,
        "out_percentile": 0.5,
        "seed_reach_count": 0,
        "truncated_by_depth": false,
        "volume_percentile": 0.4
      },
      "gid": "1",
      "next_actions": [
        "Запросить недостающие входящие переводы seed; до проверки полноты не использовать отношение исходящих к входящим как полный баланс.",
        "Проверить наблюдаемые переводы с 1 контрагентами и полноту периода и порога выгрузки; отсутствие выраженной роли не исключает необходимости проверки."
      ],
      "priority_breakdown": {
        "counterparties": {
          "contribution": 0.16000000000000003,
          "signal": 0.8,
          "weight": 0.2
        },
        "external_clusters": {
          "contribution": 0.049999999999999996,
          "signal": 0.3333333333333333,
          "weight": 0.15
        },
        "seed_reach": {
          "contribution": 0.0,
          "signal": 0.0,
          "weight": 0.35
        },
        "volume": {
          "contribution": 0.12,
          "signal": 0.4,
          "weight": 0.3
        }
      },
      "priority_score": 0.33,
      "role": "peripheral",
      "role_candidates": [
        {
          "role": "peripheral",
          "score": 0.0
        }
      ],
      "role_score": 0.0,
      "warnings": [
        "OBSERVED_SUBGRAPH_ONLY",
        "ROLE_IS_HYPOTHESIS",
        "SEED_INCOMING_INCOMPLETE",
        "OBSERVED_OUTFLOW_EXCEEDS_INFLOW"
      ],
      "why": "Приоритет проверки: достижим из 0 seed; max(вход,выход)=10000 KZT; контрагентов 1; внешних кластеров 1."
    },
    {
      "cluster_id": 0,
      "evidence": "Недостаточно признаков роли: отправителей 0, получателей 1, достижим из 0 seed. Seed: входящие неполны.",
      "features": {
        "boundary_node": false,
        "counterparty_count": 1,
        "counterparty_percentile": 0.8,
        "cross_cluster_edges": 1,
        "direct_seed_senders": 0,
        "external_cluster_count": 1,
        "in_percentile": 0.0,
        "min_seed_hops": null,
        "nonself_in_deg": 0,
        "nonself_out_deg": 1,
        "observed_in_kzt": 0.0,
        "observed_out_kzt": 20000.0,
        "observed_pass_through": null,
        "out_percentile": 0.75,
        "seed_reach_count": 0,
        "truncated_by_depth": false,
        "volume_percentile": 0.6
      },
      "gid": "2",
      "next_actions": [
        "Запросить недостающие входящие переводы seed; до проверки полноты не использовать отношение исходящих к входящим как полный баланс.",
        "Проверить наблюдаемые переводы с 1 контрагентами и полноту периода и порога выгрузки; отсутствие выраженной роли не исключает необходимости проверки."
      ],
      "priority_breakdown": {
        "counterparties": {
          "contribution": 0.16000000000000003,
          "signal": 0.8,
          "weight": 0.2
        },
        "external_clusters": {
          "contribution": 0.049999999999999996,
          "signal": 0.3333333333333333,
          "weight": 0.15
        },
        "seed_reach": {
          "contribution": 0.0,
          "signal": 0.0,
          "weight": 0.35
        },
        "volume": {
          "contribution": 0.18,
          "signal": 0.6,
          "weight": 0.3
        }
      },
      "priority_score": 0.39,
      "role": "peripheral",
      "role_candidates": [
        {
          "role": "peripheral",
          "score": 0.0
        }
      ],
      "role_score": 0.0,
      "warnings": [
        "OBSERVED_SUBGRAPH_ONLY",
        "ROLE_IS_HYPOTHESIS",
        "SEED_INCOMING_INCOMPLETE",
        "OBSERVED_OUTFLOW_EXCEEDS_INFLOW"
      ],
      "why": "Приоритет проверки: достижим из 0 seed; max(вход,выход)=20000 KZT; контрагентов 1; внешних кластеров 1."
    },
    {
      "cluster_id": 0,
      "evidence": "Недостаточно признаков роли: отправителей 0, получателей 1, достижим из 0 seed. Seed: входящие неполны.",
      "features": {
        "boundary_node": false,
        "counterparty_count": 1,
        "counterparty_percentile": 0.8,
        "cross_cluster_edges": 1,
        "direct_seed_senders": 0,
        "external_cluster_count": 1,
        "in_percentile": 0.0,
        "min_seed_hops": null,
        "nonself_in_deg": 0,
        "nonself_out_deg": 1,
        "observed_in_kzt": 0.0,
        "observed_out_kzt": 30000.0,
        "observed_pass_through": null,
        "out_percentile": 1.0,
        "seed_reach_count": 0,
        "truncated_by_depth": false,
        "volume_percentile": 0.8
      },
      "gid": "3",
      "next_actions": [
        "Запросить недостающие входящие переводы seed; до проверки полноты не использовать отношение исходящих к входящим как полный баланс.",
        "Проверить наблюдаемые переводы с 1 контрагентами и полноту периода и порога выгрузки; отсутствие выраженной роли не исключает необходимости проверки."
      ],
      "priority_breakdown": {
        "counterparties": {
          "contribution": 0.16000000000000003,
          "signal": 0.8,
          "weight": 0.2
        },
        "external_clusters": {
          "contribution": 0.049999999999999996,
          "signal": 0.3333333333333333,
          "weight": 0.15
        },
        "seed_reach": {
          "contribution": 0.0,
          "signal": 0.0,
          "weight": 0.35
        },
        "volume": {
          "contribution": 0.24,
          "signal": 0.8,
          "weight": 0.3
        }
      },
      "priority_score": 0.45,
      "role": "peripheral",
      "role_candidates": [
        {
          "role": "peripheral",
          "score": 0.0
        }
      ],
      "role_score": 0.0,
      "warnings": [
        "OBSERVED_SUBGRAPH_ONLY",
        "ROLE_IS_HYPOTHESIS",
        "SEED_INCOMING_INCOMPLETE",
        "OBSERVED_OUTFLOW_EXCEEDS_INFLOW"
      ],
      "why": "Приоритет проверки: достижим из 0 seed; max(вход,выход)=30000 KZT; контрагентов 1; внешних кластеров 1."
    },
    {
      "cluster_id": 1,
      "evidence": "Признаки консолидации: 3 отправителей; вход 60000 KZT; 1 получателей.",
      "features": {
        "boundary_node": false,
        "counterparty_count": 4,
        "counterparty_percentile": 1.0,
        "cross_cluster_edges": 3,
        "direct_seed_senders": 3,
        "external_cluster_count": 1,
        "in_percentile": 1.0,
        "min_seed_hops": 1,
        "nonself_in_deg": 3,
        "nonself_out_deg": 1,
        "observed_in_kzt": 60000.0,
        "observed_out_kzt": 5000.0,
        "observed_pass_through": 0.08333333333333333,
        "out_percentile": 0.25,
        "seed_reach_count": 3,
        "truncated_by_depth": false,
        "volume_percentile": 1.0
      },
      "gid": "4",
      "next_actions": [
        "Проверить источники поступлений от 3 отправителей и основания переводов; сопоставить даты и суммы."
      ],
      "priority_breakdown": {
        "counterparties": {
          "contribution": 0.2,
          "signal": 1.0,
          "weight": 0.2
        },
        "external_clusters": {
          "contribution": 0.049999999999999996,
          "signal": 0.3333333333333333,
          "weight": 0.15
        },
        "seed_reach": {
          "contribution": 0.21,
          "signal": 0.6,
          "weight": 0.35
        },
        "volume": {
          "contribution": 0.3,
          "signal": 1.0,
          "weight": 0.3
        }
      },
      "priority_score": 0.76,
      "role": "consolidator",
      "role_candidates": [
        {
          "role": "consolidator",
          "score": 0.875
        }
      ],
      "role_score": 0.875,
      "warnings": [
        "OBSERVED_SUBGRAPH_ONLY",
        "ROLE_IS_HYPOTHESIS"
      ],
      "why": "Приоритет проверки: достижим из 3 seed; max(вход,выход)=60000 KZT; контрагентов 4; внешних кластеров 1."
    },
    {
      "cluster_id": 1,